title,hook,text,hashtags,link,source,score
"Azul: ações fecham estáveis, mas desabam 41% em abril; como analistas veem AZUL4?",Azul em turbulência? Vamos analisar o que os especialistas dizem sobre AZUL4.,"As ações da Azul, apesar de estáveis agora, sofreram uma queda de 41% em abril. Com essa
volatilidade, você pode estar se perguntando sobre o futuro de AZUL4. Analistas estão de
olho, avaliando cuidadosamente as perspectivas dessa gigante da aviação. O mercado é
imprevisível e oscilações são esperadas. A chave é não se deixar levar pelo pânico, mas
sim estar consciente e bem informado. Lembre-se, cada queda pode ser uma oportunidade.
Fique atento às análises e estude antes de tomar qualquer decisão. A Alta Vista
Investimentos está aqui para te guiar nesse caminho. Acompanhe nossos conteúdos e fique
por dentro das tendências do mercado financeiro. Investir é uma jornada, e estamos aqui
para percorrê-la com você.",#Azul4 #Investimentos #MercadoFinanceiro #AltaVistaInvestimentos #Oportunidades,https://www.infomoney.com.br/mercados/azul-acoes-tem-outro-dia-de-queda-e-desabam-46-em-abril-como-analistas-veem-azul4/,InfoMoney,4.2
Ibovespa fecha acima dos 135 mil pela primeira vez desde setembro,Ibovespa atinge marco histórico. Sabe o que isso significa para o seu investimento?,"Em um notável movimento de recuperação, o Ibovespa ultrapassou a marca dos 135 mil pontos
pela primeira vez desde setembro. Esse marco é um sinal positivo que indica um ambiente de
otimismo no mercado acionário brasileiro. Para os investidores que estão sempre de olho
nas tendências, isso pode representar oportunidades significativas. No entanto, é
fundamental lembrar que a prudência e a estratégia devem sempre caminhar lado a lado com a
ousadia. Entender o momento do mercado é essencial, mas manter o foco no longo prazo é o
que realmente constrói patrimônio. Quer saber mais sobre como essas tendências podem
impactar seus investimentos? Converse com um de nossos especialistas.",#Ibovespa #Investimento #MercadoAcionário #AltaVistaInvestimentos #Tendências,https://www.infomoney.com.br/mercados/ibovespa-hoje-bolsa-de-valores-ao-vivo-28042025/,InfoMoney,4.2
"Dólar cai pela 7ª sessão seguida, a R$ 5,64, em linha com movimento do exterior",O dólar cai pela 7ª sessão seguida! Entenda o que isso significa para seus investimentos.,"O mercado financeiro é um universo dinâmico e cheio de oportunidades. Recentemente, o
dólar registrou queda pela sétima sessão consecutiva, fechando a R$ 5,64. Esse movimento
está em linha com a tendência observada nos mercados internacionais. Mas o que isso
realmente significa para o investidor? Essa queda pode indicar um momento propício para
investir em ativos dolarizados, uma vez que eles estão mais acessíveis. Além disso, pode
ser interessante para quem planeja viagens internacionais. Mas lembre-se: a decisão de
investir deve ser sempre embasada em análises criteriosas e alinhada aos seus objetivos
pessoais. Quer saber mais sobre como aproveitar as oportunidades do mercado financeiro?
Entre em contato conosco!",#Dólar #Investimentos #MercadoFinanceiro #AltaVistaInvestimentos #Economia,https://www.infomoney.com.br/mercados/dolar-hoje-tem-leve-alta-em-meio-a-incertezas-sobre-guerra-comercial/,InfoMoney,4.2
S&P 500 fecha quase estável antes de dados e balanços de megacaps,O S&P 500 se mantém firme. Quer saber o porquê?,"O índice S&P 500, um dos mais importantes do mundo, fechou praticamente estável,
evidenciando a força e resiliência dos mercados mesmo em tempos incertos. A razão? A
expectativa de novos dados econômicos e resultados financeiros de megacorporações. Isso
mostra que os investidores estão atentos e agindo com cautela, esperando para ver como os
gigantes da economia estão se saindo antes de fazer seus próximos movimentos. O
investimento inteligente está sempre um passo à frente. E você, está pronto para
acompanhar o ritmo do mercado e tomar decisões informadas? Junte-se a nós na Alta Vista
Investimentos e vamos juntos traçar a melhor estratégia para o seu patrimônio!",#SP500 #InvestimentoInteligente #AltaVistaInvestimentos #EconomiaGlobal #MercadoFinanceiro,https://www.infomoney.com.br/mercados/sp-500-fecha-quase-estavel-antes-de-dados-e-balancos-de-megacaps/,InfoMoney,4.0
Premiê da Espanha anuncia restabelecimento parcial da eletricidade após apagão,Luz no fim do túnel para investidores do setor de energia na Espanha.,"Uma excelente notícia para investidores atentos ao setor de energia e infraestrutura na
Espanha. O primeiro-ministro do país anunciou o restabelecimento parcial da eletricidade
após um apagão que gerou incerteza e preocupação. Esse movimento é um sinal positivo para
o mercado, mostrando a resiliência do setor e a capacidade de recuperação rápida em
situações adversas. Investir em energia e infraestrutura é investir em um setor vital para
qualquer economia, e a Espanha prova ser um cenário interessante. Acompanhe de perto o
desenrolar desta situação e mantenha-se informado para as melhores oportunidades de
investimento. Lembre-se: Informação é poder quando se trata de investimentos.",#Energia #Investimentos #Espanha #Infraestrutura #MercadoFinanceiro,https://www.infomoney.com.br/mundo/premie-da-espanha-anuncia-restabelecimento-parcial-da-eletricidade-apos-apagao/,InfoMoney,4.0
